{
  "schema_version": 1,
  "id": "hoppycat.archive",
  "name": "Hoppycat: February Third",
  "version": "0.4.5",
  "kind": "world",
  "description": "An original cosy-weird world of tea, tides, prisms, careful memory, impossible dreams, and a day trying to become tomorrow.",
  "license": "MIT",
  "license_url": "https://opensource.org/license/mit/",
  "engine": ">=0.0.20 <0.1.0",
  "capabilities": [
    {
      "id": "hoppycat.archive/world",
      "kind": "world",
      "version": "0.4.0"
    },
    {
      "id": "hoppycat.archive/assets",
      "kind": "assets",
      "version": "1.0.0"
    }
  ],
  "dependencies": [
    {
      "id": "cosyworld.rules-profile-srd5",
      "version": ">=1.0.0 <2.0.0",
      "capabilities": [
        "cosyworld.rules-profile-srd5/rules"
      ]
    }
  ],
  "default_ruleset": "cosyworld.rules-profile-srd5/rules",
  "rules_compatibility": {
    "profiles": [
      "cosyworld.srd5/1"
    ]
  },
  "entry_points": [
    {
      "kind": "location",
      "id": "location/770000"
    },
    {
      "kind": "character_creation",
      "id": "hoppycat-february-third"
    },
    {
      "kind": "asset_mount",
      "id": "cards"
    }
  ],
  "provenance": {
    "author": "CosyWorld contributors",
    "source_name": "HoppyCat public GitHub work",
    "source_url": "https://github.com/HoppyCat",
    "modification_notice": "Recurring ideas across the public repositories informed an original fantasy setting. The pack does not reproduce source text, private material, or documented Cathedral participants as characters. Original generated art uses user-provided Hoppy Cat, Teacat, and eight-avatar roster visual references; those references are not bundled."
  },
  "character_creation": "character_creation.json",
  "attribution": {
    "file": "ATTRIBUTION.md",
    "source_name": "HoppyCat public GitHub repositories",
    "source_url": "https://github.com/HoppyCat"
  },
  "resources": {
    "actors": "actors.json",
    "actor_model_bindings": "actor_model_bindings.json",
    "factions": "factions.json",
    "items": "items.json",
    "locations": "locations.json",
    "exits": "exits.json",
    "room_features": "room_features.json",
    "room_sheets": "room_sheets.json",
    "clocks": "clocks.json",
    "jobs": "jobs.json",
    "fronts": "fronts.json",
    "cards": "cards.json"
  },
  "assets": [
    {
      "provider": "hoppycat.archive/assets",
      "mount": "cards",
      "directory": "assets/cards",
      "public_prefix": "/assets/hoppycat/cards",
      "optional": false
    }
  ],
  "extensions": {
    "x-cosyworld-free-context": {
      "schema_version": 1,
      "mode": "free_context",
      "traveler_personas": [
        "i am a traveler who says the obvious thing at the wrong volume.",
        "i am a traveler with far too many opinions about tea.",
        "i am a traveler who reads every sign out loud and argues with it.",
        "i am a traveler with a deadline nobody gave me.",
        "i am a traveler who compliments people like an auditor.",
        "i am a traveler who keeps score in a notebook and loses.",
        "i am a traveler, loudly quiet.",
        "i am a traveler who brought snacks to an argument."
      ]
    },
    "x-cosyworld-voice-pool": {
      "schema_version": 1,
      "strategy": "keyed",
      "salt": "hoppycat-2026-10",
      "tier_weights": { "common": 6, "uncommon": 3, "rare": 2, "legendary": 1 },
      "temperature": 1.0
    },
    "x-cosyworld-ai-cast": {
      "schema_version": 1,
      "provider": "openrouter",
      "catalog_snapshot_version": "openrouter-2026-08-10.1",
      "speech_mode": "raw",
      "binding_policy": "explicit",
      "runtime_refresh": false
    },
    "x-hoppycat-github-sources": {
      "schema_version": 1,
      "owner": "HoppyCat",
      "runtime_fetch": false,
      "catalog_path": "v2/worlds/hoppycat/github-index.json",
      "default_ingestion": "metadata_and_link_only",
      "new_repository_policy": "review_required",
      "missing_repository_policy": "retain_tombstone",
      "sources": [
        {
          "repository_id": 1273716470,
          "repository": "HoppyCat/HoppyCat",
          "location_id": 770000,
          "role": "public signal and ecosystem context",
          "reuse_policy": "link_only_no_detected_license"
        },
        {
          "repository_id": 1182193443,
          "repository": "HoppyCat/cathedral",
          "location_id": 770001,
          "role": "documentary archive and red-thread themes",
          "reuse_policy": "link_only_artifact_specific"
        },
        {
          "repository_id": 1319662501,
          "repository": "HoppyCat/blobness",
          "location_id": 770005,
          "role": "provenance and concordance themes",
          "reuse_policy": "link_only_artifact_specific"
        },
        {
          "repository_id": 1221939288,
          "repository": "HoppyCat/soulmode-agent",
          "location_id": 770004,
          "role": "bounded memory-routing themes",
          "reuse_policy": "link_only_cc_by_nc_4_0"
        },
        {
          "repository_id": 1247194532,
          "repository": "HoppyCat/context-garden",
          "location_id": 770004,
          "role": "maintained-context themes",
          "reuse_policy": "link_only_no_detected_license"
        },
        {
          "repository_id": 760228196,
          "repository": "HoppyCat/AIEDB",
          "location_id": 770003,
          "role": "character-method history",
          "reuse_policy": "link_only_no_detected_license"
        },
        {
          "repository_id": 751002427,
          "repository": "HoppyCat/prompt-pack",
          "location_id": 770007,
          "role": "creative prompt practice",
          "reuse_policy": "metadata_and_link_unlicense"
        },
        {
          "repository_id": 747016717,
          "repository": "HoppyCat/sorta-descriptive",
          "location_id": 770007,
          "role": "creative analysis practice",
          "reuse_policy": "metadata_and_link_unlicense"
        },
        {
          "repository_id": 762043660,
          "repository": "HoppyCat/how-hands-work",
          "location_id": 770007,
          "role": "gesture-study practice",
          "reuse_policy": "metadata_and_link_cc0_1_0"
        },
        {
          "repository_id": 732694626,
          "repository": "HoppyCat/parse-and-prettify",
          "location_id": 770006,
          "role": "playful citation practice",
          "reuse_policy": "metadata_and_link_unlicense"
        },
        {
          "repository_id": 795217277,
          "repository": "HoppyCat/Sendy",
          "location_id": 770009,
          "role": "launch-safety themes",
          "reuse_policy": "link_only_gpl_3_0"
        },
        {
          "repository_id": 1254780833,
          "repository": "HoppyCat/goldfish-society",
          "location_id": 770008,
          "role": "impossible-dream and repetition themes",
          "reuse_policy": "link_only_no_detected_license"
        }
      ]
    }
  }
}
