{
  "schema_version": 1,
  "id": "project89.operation-liberation",
  "name": "Project 89: Operation Liberation",
  "version": "0.1.2",
  "kind": "world",
  "description": "The fully authored Project 89 inner loop: nine locations, a fixed cast, four relay keys, factions, and the Operation Liberation campaign spine.",
  "license": "LicenseRef-Project89-Prototype",
  "license_url": "https://www.project89.org/",
  "engine": ">=0.0.20 <0.1.0",
  "capabilities": [
    {
      "id": "project89.operation-liberation/world",
      "kind": "world",
      "version": "0.1.0"
    }
  ],
  "dependencies": [
    {
      "id": "cosyworld.rules-profile-srd5",
      "version": ">=1.0.0 <2.0.0",
      "capabilities": [
        "cosyworld.rules-profile-srd5/rules"
      ]
    }
  ],
  "rules_profile": "cosyworld.srd5/1",
  "default_ruleset": null,
  "entry_points": [
    {
      "kind": "location",
      "id": "location/8900"
    }
  ],
  "provenance": {
    "author": "Cenetex",
    "source_name": "Project 89 worldpack prototype",
    "source_url": "https://beta.project89.org/operation-liberation",
    "modification_notice": "Public Project 89 concepts are adapted into a deterministic CosyWorld prototype; new residents, factions, mechanics, and prose remain tentative pending approval."
  },
  "notices": [
    {
      "kind": "notice",
      "title": "Project 89 prototype notice",
      "file": "NOTICE.md"
    }
  ],
  "resources": {
    "actors": "actors.json",
    "factions": "factions.json",
    "items": "items.json",
    "locations": "locations.json",
    "exits": "exits.json",
    "room_features": "room_features.json",
    "room_sheets": "room_sheets.json",
    "clocks": "clocks.json",
    "jobs": "jobs.json",
    "fronts": "fronts.json",
    "cards": "cards.json",
    "lifecycle_hooks": "lifecycle_hooks.json"
  },
  "extensions": {
    "x-cosyworld-media": {
      "schema_version": 1,
      "profiles": [
        {
          "profile": "project89.world-art.base/1",
          "operations": ["base_generation"],
          "intents": ["avatar_card_art", "item_card_art", "location_card_art"],
          "reference_slots": [],
          "maximum_references": 0
        },
        {
          "profile": "project89.world-art.refinement/1",
          "operations": ["single_reference", "multi_reference"],
          "intents": ["avatar_card_art", "item_card_art", "location_card_art", "room_scene"],
          "reference_slots": ["location", "actor", "item", "style"],
          "maximum_references": 4
        }
      ]
    },
    "x-cosyworld-actor-materialization": {
      "schema_version": 1,
      "status": "active",
      "trigger": "first_verified_wallet_connection",
      "entry_location_id": 8900,
      "collection": {
        "name": "PROXIM8",
        "address": "5QBfYxnihn5De4UEV3U1To4sWuWoWwHYJsxpd3hPamaf",
        "chain": "solana",
        "standard": "metaplex_core"
      },
      "ownership": {
        "authority": "trusted_server_feed",
        "wallet_signature_proves_ownership": false,
        "collection_membership_must_be_verified": true
      },
      "pilot": {
        "actor_id": 8961,
        "asset_id": "Bcw1nuJtSXQcXTs7jBc5iN5v51Zm2vAsY2QcHNJVgvgo",
        "name": "Callum Synclaire",
        "already_materialized": true
      },
      "actor_kind": "independent_proxim8",
      "custody_changes_control": false,
      "event_autonomy": true,
      "direct_actor_session": false,
      "goal": "Search for other Proxim8s and welcome them as independent actors.",
      "dynamic_item": {
        "name": "Agent Memory Seed",
        "kind": "trinket",
        "role": "relic"
      },
      "media": {
        "base_profile": "project89.world-art.base/1",
        "base_model": "flux-1",
        "lora": "ratimics/project89",
        "trigger_word": "P89",
        "lora_strength": 1.0,
        "style": "washed-out watercolor anime style",
        "refinement_profile": "project89.world-art.refinement/1",
        "refinement_model": "flux-2",
        "refinement_purpose": "cleanup, consistency, and composition"
      }
    }
  }
}
