{
  "schema_version": 1,
  "id": "cosyworld.composition.core-lantern-keeper",
  "name": "CosyWorld Core + Lantern Keeper Bridge",
  "version": "1.0.0",
  "kind": "world",
  "description": "Composition-owned paths connecting CosyWorld Core and The Lantern Keeper, including the road the relit beacon opens.",
  "license": "MIT",
  "license_url": "https://opensource.org/license/mit",
  "engine": ">=0.0.20 <0.1.0",
  "capabilities": [
    {
      "id": "cosyworld.composition.core-lantern-keeper/world",
      "kind": "world",
      "version": "1.0.0"
    }
  ],
  "dependencies": [
    {
      "id": "cosyworld.core",
      "version": ">=1.3.0 <2.0.0",
      "capabilities": [
        "cosyworld.core/world"
      ]
    },
    {
      "id": "cosyworld.campaign.the-lantern-keeper",
      "version": ">=0.1.8 <1.0.0",
      "capabilities": [
        "cosyworld.campaign.the-lantern-keeper/world"
      ]
    },
    {
      "id": "cosyworld.rules-profile-srd5",
      "version": ">=1.0.0 <2.0.0",
      "capabilities": [
        "cosyworld.rules-profile-srd5/rules"
      ]
    }
  ],
  "rules_profile": "cosyworld.srd5/1",
  "default_ruleset": null,
  "entry_points": [],
  "provenance": {
    "author": "Cenetex",
    "source_name": "CosyWorld official composition",
    "source_url": "https://github.com/cenetex/cosyworld"
  },
  "resources": {
    "exits": "exits.json"
  },
  "extensions": {
    "x-cosyworld-composition": {
      "schema_version": 1,
      "role": "bridge"
    },
    "x-cosyworld-generation": {
      "schema_version": 1,
      "policy_id": "cosyworld.composition.core-lantern-keeper/generation/1",
      "migration_version": 1,
      "collision_namespace": "pack://cosyworld.composition.core-lantern-keeper/generated/v1",
      "migrations": [
        {
          "from_policy_id": "cosyworld.compatibility.host-generation/1",
          "from_migration_version": 0,
          "from_pack_version": "1.0.0",
          "mode": "preserve_descendants"
        }
      ],
      "cross_pack_routes": [
        {
          "endpoints": [
            {
              "pack_id": "cosyworld.core",
              "location_id": 4
            },
            {
              "pack_id": "cosyworld.campaign.the-lantern-keeper",
              "location_id": 800
            }
          ],
          "route_owner": "cosyworld.composition.core-lantern-keeper",
          "generated_descendant_owner": "cosyworld.composition.core-lantern-keeper",
          "topology_authority": {
            "pack_id": "cosyworld.composition.core-lantern-keeper",
            "migration_version": 1
          },
          "ecology_transition": "endpoint_blend/1",
          "media_profile_id": "cosyworld.community-art.base/1",
          "unmount": "remove_with_route_owner",
          "evacuation": "world_pack_lifecycle"
        },
        {
          "endpoints": [
            {
              "pack_id": "cosyworld.campaign.the-lantern-keeper",
              "location_id": 804
            },
            {
              "pack_id": "cosyworld.core",
              "location_id": 32
            }
          ],
          "route_owner": "cosyworld.composition.core-lantern-keeper",
          "generated_descendant_owner": "cosyworld.composition.core-lantern-keeper",
          "topology_authority": {
            "pack_id": "cosyworld.composition.core-lantern-keeper",
            "migration_version": 1
          },
          "ecology_transition": "endpoint_blend/1",
          "media_profile_id": "cosyworld.community-art.base/1",
          "unmount": "remove_with_route_owner",
          "evacuation": "world_pack_lifecycle"
        }
      ]
    }
  }
}
