{
  "schema_version": 1,
  "id": "cosyworld.campaign.the-lantern-keeper",
  "name": "The Lantern Keeper",
  "version": "0.1.6",
  "kind": "campaign",
  "description": "A short fifth-edition-inspired campaign about a missing keeper and a beacon going dark.",
  "license": "CC-BY-4.0",
  "license_url": "https://creativecommons.org/licenses/by/4.0/",
  "engine": ">=0.0.20 <0.1.0",
  "capabilities": [
    {
      "id": "cosyworld.campaign.the-lantern-keeper/world",
      "kind": "world",
      "version": "0.1.0"
    }
  ],
  "dependencies": [
    {
      "id": "cosyworld.core",
      "version": ">=1.0.0 <2.0.0",
      "capabilities": [
        "cosyworld.core/world"
      ]
    },
    {
      "id": "cosyworld.rules-srd-5.1",
      "version": ">=0.1.0 <1.0.0",
      "capabilities": [
        "cosyworld.rules-srd-5.1/reference"
      ]
    },
    {
      "id": "cosyworld.rules-profile-srd5",
      "version": ">=1.0.0 <2.0.0",
      "capabilities": [
        "cosyworld.rules-profile-srd5/rules"
      ]
    }
  ],
  "rules_profile": "cosyworld.srd5/1",
  "default_ruleset": null,
  "entry_points": [
    {
      "kind": "location",
      "id": "location/800"
    },
    {
      "kind": "character_creation",
      "id": "the-lantern-keeper"
    }
  ],
  "provenance": {
    "author": "Cenetex",
    "source_name": "CosyWorld and System Reference Document 5.1",
    "source_url": "https://github.com/cenetex/cosyworld",
    "modification_notice": "Original CosyWorld campaign material adapts selected SRD 5.1 rules references."
  },
  "character_creation": "character_creation.json",
  "attribution": {
    "file": "ATTRIBUTION.md",
    "source_name": "System Reference Document 5.1",
    "source_url": "https://www.dndbeyond.com/srd"
  },
  "resources": {
    "actors": "actors.json",
    "items": "items.json",
    "locations": "locations.json",
    "exits": "exits.json",
    "room_features": "room_features.json",
    "room_sheets": "room_sheets.json",
    "clocks": "clocks.json",
    "jobs": "jobs.json",
    "fronts": "fronts.json",
    "cards": "cards.json",
    "lifecycle_hooks": "lifecycle_hooks.json"
  }
}
